<?xml version="1.0"?>
<!--
To change this license header, choose License Headers in Project Properties.
To change this template file, choose Tools | Templates
and open the template in the editor.
-->

<xs:schema xmlns:xs="http://www.w3.org/2001/XMLSchema"
           targetNamespace="http://learn.it.uts.edu.au/wsd"
           xmlns="http://learn.it.uts.edu.au/wsd"
           elementFormDefault="qualified">
    
    <xs:simpleType name="email">
        <xs:restriction base="xs:string">
            <xs:pattern value="[a-zA-Z\._]+[@][a-z]+([\.][a-z-]+)+"/>
        </xs:restriction>
    </xs:simpleType>
    
    <xs:simpleType name="name">
        <xs:restriction base="xs:string">
            <xs:pattern value="[A-Z][a-zA-Z]*([ ][A-Z][a-zA-Z]*)*"/>
        </xs:restriction>
    </xs:simpleType>
    
     <xs:simpleType name="phoneNumber">
        <xs:restriction base="xs:integer">
            <xs:pattern value="[0-9]*"/>
        </xs:restriction>
    </xs:simpleType>

    <xs:element name="users">
        <xs:complexType>
            <xs:sequence>
                <xs:element name="user" minOccurs="0" maxOccurs="unbounded">
                    <xs:complexType>
                        <xs:sequence>
                            <xs:element name="email" type="email"/>
                            <xs:element name="name" type="name"/>
                            <xs:element name="password" type="xs:string"/>
                            <xs:element name="phoneNumber" type="phoneNumber"/>
                            <xs:element name="address" type="xs:string"/>
                        </xs:sequence>
                    </xs:complexType>
                </xs:element>
            </xs:sequence>
        </xs:complexType>
    </xs:element>

</xs:schema>
